{
  "binary_spinor": {
    "SpinC_roots": [
      "+i",
      "-i"
    ],
    "carrier": "S=C^2, the selected binary sheet SpinC carrier",
    "combined_generator_squares": [
      "(+i q_a)^2=1",
      "(-i q_a)^2=1"
    ],
    "determinant_character": "sign",
    "group": "Dic3 -> S3",
    "q1_quaternion": [
      "0",
      "sqrt(2)/2",
      "-sqrt(2)/2",
      "0"
    ],
    "q2_quaternion": [
      "0",
      "0",
      "sqrt(2)/2",
      "-sqrt(2)/2"
    ],
    "relations": [
      "q1^2=q2^2=-1",
      "q1 q2 q1=q2 q1 q2",
      "(q1 q2)^3=-1"
    ],
    "unselected_conjugate_presentations": 2
  },
  "checks": {
    "T24_does_not_regrade_mixed_H2_to_augmented_H1": true,
    "adjoint_q1_has_signed_permutation_character": true,
    "adjoint_q1_is_orthogonal": true,
    "adjoint_q2_has_signed_permutation_character": true,
    "adjoint_q2_is_orthogonal": true,
    "all_local_source_hashes_match": true,
    "binary_braid_relation": true,
    "binary_product_cube_is_minus_one": true,
    "combined_identity_character_is_four": true,
    "combined_representation_has_rank_four": true,
    "combined_three_cycle_character_is_one": true,
    "combined_transposition_character_is_zero": true,
    "determinant_twist_q1_is_literal_P23": true,
    "determinant_twist_q2_is_literal_P12": true,
    "generated_sheet_group_has_order_six": true,
    "generated_sheet_group_is_closed": true,
    "hidden_adjoint_HYM_is_unchanged_by_flat_line_twist": true,
    "hidden_visible_common_endpoint_is_not_claimed": true,
    "no_continuous_physical_parameters": true,
    "no_discrete_physical_selectors": true,
    "no_fitted_values": true,
    "no_observed_inputs": true,
    "physical_HYM_soldering_is_not_claimed": true,
    "physical_packet_acceptance_stays_zero_of_three": true,
    "physical_row_acceptance_stays_zero_of_seven": true,
    "q1_is_unit": true,
    "q1_square_is_minus_one": true,
    "q2_is_unit": true,
    "q2_square_is_minus_one": true,
    "qutrit_to_binary_maps_are_not_claimed": true,
    "rank_three_lane_is_sheet_permutation_system": true,
    "root_selector_is_not_added": true,
    "shared_line_is_flat_SpinC_determinant": true,
    "twisted_braid_relation": true,
    "twisted_generators_are_involutions": true,
    "twisted_product_has_order_three": true,
    "two_conjugate_roots_are_equivalent": true
  },
  "claim_id": "CBF.T62",
  "date": "2026-09-02",
  "flat_rootstack_compiler": {
    "character_on_identity_transposition_three_cycle": [
      4,
      0,
      1
    ],
    "generator_1": [
      [
        -1,
        0,
        0,
        0
      ],
      [
        0,
        1,
        0,
        0
      ],
      [
        0,
        0,
        0,
        1
      ],
      [
        0,
        0,
        1,
        0
      ]
    ],
    "generator_2": [
      [
        -1,
        0,
        0,
        0
      ],
      [
        0,
        0,
        1,
        0
      ],
      [
        0,
        1,
        0,
        0
      ],
      [
        0,
        0,
        0,
        1
      ]
    ],
    "holonomy_rows": [
      {
        "class": "identity",
        "combined_1_plus_3_matrix": [
          [
            1,
            0,
            0,
            0
          ],
          [
            0,
            1,
            0,
            0
          ],
          [
            0,
            0,
            1,
            0
          ],
          [
            0,
            0,
            0,
            1
          ]
        ],
        "combined_character": 4,
        "determinant_character": 1,
        "parity": 0,
        "sheet_matrix": [
          [
            1,
            0,
            0
          ],
          [
            0,
            1,
            0
          ],
          [
            0,
            0,
            1
          ]
        ],
        "word": "e"
      },
      {
        "class": "transposition",
        "combined_1_plus_3_matrix": [
          [
            -1,
            0,
            0,
            0
          ],
          [
            0,
            1,
            0,
            0
          ],
          [
            0,
            0,
            0,
            1
          ],
          [
            0,
            0,
            1,
            0
          ]
        ],
        "combined_character": 0,
        "determinant_character": -1,
        "parity": 1,
        "sheet_matrix": [
          [
            1,
            0,
            0
          ],
          [
            0,
            0,
            1
          ],
          [
            0,
            1,
            0
          ]
        ],
        "word": "1"
      },
      {
        "class": "transposition",
        "combined_1_plus_3_matrix": [
          [
            -1,
            0,
            0,
            0
          ],
          [
            0,
            0,
            0,
            1
          ],
          [
            0,
            0,
            1,
            0
          ],
          [
            0,
            1,
            0,
            0
          ]
        ],
        "combined_character": 0,
        "determinant_character": -1,
        "parity": 1,
        "sheet_matrix": [
          [
            0,
            0,
            1
          ],
          [
            0,
            1,
            0
          ],
          [
            1,
            0,
            0
          ]
        ],
        "word": "121"
      },
      {
        "class": "transposition",
        "combined_1_plus_3_matrix": [
          [
            -1,
            0,
            0,
            0
          ],
          [
            0,
            0,
            1,
            0
          ],
          [
            0,
            1,
            0,
            0
          ],
          [
            0,
            0,
            0,
            1
          ]
        ],
        "combined_character": 0,
        "determinant_character": -1,
        "parity": 1,
        "sheet_matrix": [
          [
            0,
            1,
            0
          ],
          [
            1,
            0,
            0
          ],
          [
            0,
            0,
            1
          ]
        ],
        "word": "2"
      },
      {
        "class": "three_cycle",
        "combined_1_plus_3_matrix": [
          [
            1,
            0,
            0,
            0
          ],
          [
            0,
            0,
            1,
            0
          ],
          [
            0,
            0,
            0,
            1
          ],
          [
            0,
            1,
            0,
            0
          ]
        ],
        "combined_character": 1,
        "determinant_character": 1,
        "parity": 0,
        "sheet_matrix": [
          [
            0,
            1,
            0
          ],
          [
            0,
            0,
            1
          ],
          [
            1,
            0,
            0
          ]
        ],
        "word": "12"
      },
      {
        "class": "three_cycle",
        "combined_1_plus_3_matrix": [
          [
            1,
            0,
            0,
            0
          ],
          [
            0,
            0,
            0,
            1
          ],
          [
            0,
            1,
            0,
            0
          ],
          [
            0,
            0,
            1,
            0
          ]
        ],
        "combined_character": 1,
        "determinant_character": 1,
        "parity": 0,
        "sheet_matrix": [
          [
            0,
            0,
            1
          ],
          [
            1,
            0,
            0
          ],
          [
            0,
            1,
            0
          ]
        ],
        "word": "21"
      }
    ],
    "identity": "D tensor End(S)=D tensor C.I2 direct-sum D tensor sl(S)=L_shared direct-sum E_D^C",
    "new_parameter_or_selector": false,
    "ordered_1_plus_3_basis": [
      "I2",
      "sigma_x",
      "sigma_y",
      "sigma_z"
    ],
    "rank_three_lane": "D tensor sl(S)=E_D^C",
    "root_independence": "The +/-i phases cancel on End(S), and both determinant characters are sign.",
    "scalar_lane": "D=det(S)=L_shared, the root-independent flat SpinC sign line"
  },
  "frontier_delta": "T61's determinant-twisted Pauli possibility is now an exact global flat q79 root-stack compiler: the scalar lane is the shared SpinC determinant and the three Pauli lanes are literally the sheet-permutation local system. The unknown global map is reduced to two same-source qutrit-to-binary identifications, a genuine mixed-degree suspension, and physical HYM soldering to the antiholomorphic cotangent bundle. T24 does not supply that suspension. Physical blockers and counters do not move.",
  "hidden_HYM_compatibility": {
    "closed_identity": "End(L_shared tensor W9)=End(W9)",
    "common_visible_hidden_chamber": false,
    "connection_reason": "The flat scalar shared-line connection cancels in the adjoint commutator.",
    "curvature_HYM_constant_and_hidden_Hessian_unchanged": true,
    "physical_Hull_Strominger_endpoint": false,
    "selected_visible_V3": false
  },
  "parameter_ledger": {
    "continuous_physical_parameters": 0,
    "discrete_physical_selectors": 0,
    "equivalent_unselected_root_presentations": 2,
    "fitted_values": 0,
    "observed_inputs": 0
  },
  "pauli_adjoint": {
    "Ad_q1": [
      [
        -1,
        0,
        0
      ],
      [
        0,
        0,
        -1
      ],
      [
        0,
        -1,
        0
      ]
    ],
    "Ad_q2": [
      [
        0,
        -1,
        0
      ],
      [
        -1,
        0,
        0
      ],
      [
        0,
        0,
        -1
      ]
    ],
    "P_12": [
      [
        0,
        1,
        0
      ],
      [
        1,
        0,
        0
      ],
      [
        0,
        0,
        1
      ]
    ],
    "P_23": [
      [
        1,
        0,
        0
      ],
      [